"Business, Industry and Trade","Business, Industry and Trade","Business, Industry and Trade","Business, Industry and Trade","Business, Industry and Trade","Business, Industry and Trade","Business, Industry and Trade","Business, Industry and Trade","Business, Industry and Trade","Business, Industry and Trade","Business, Industry and Trade","Business, Industry and Trade","Business, Industry and Trade","Business, Industry and Trade","Business, Industry and Trade","Business, Industry and Trade","Business, Industry and Trade","Business, Industry and Trade","Business, Industry and Trade","Business, Industry and Trade","Business, Industry and Trade","Business, Industry and Trade","Business, Industry and Trade","Business, Industry and Trade","Business, Industry and Trade","Business, Industry and Trade","Business, Industry and Trade","Business, Industry and Trade","Business, Industry and Trade","Business, Industry and Trade","Business, Industry and Trade","Business, Industry and Trade","Business, Industry and Trade","Business, Industry and Trade","Business, Industry and Trade","Business, Industry and Trade","Business, Industry and Trade","Business, Industry and Trade","Business, Industry and Trade","Business, Industry and Trade","Business, Industry and Trade","Business, Industry and Trade",,Economy,Economy,Economy,Economy,Economy,Economy,Economy,Economy,Economy,Economy,Economy,Economy,Economy,Economy,Economy,Economy,Economy,Economy,Economy,Economy,Economy,Economy,Economy,Economy,Economy,Economy,Economy,Economy,Economy,Economy,Economy,Economy,Economy,Economy,Economy,Economy,Economy,Economy,Economy,Economy,Economy,Economy,Economy,Economy,Economy,Economy,Economy,Economy,Economy,Economy,Economy,Economy,Economy,Economy,Economy,Economy,Economy,Economy,Economy,Economy,Economy,Economy,Economy,Economy,Economy,Economy,Economy,Economy,Economy,Economy,Economy,Economy,Economy,Economy,Economy,Economy,Economy,Economy,Economy,Economy,Economy,Economy,Economy,Economy,Economy,Economy,Economy,Economy,Economy,Economy,,Employment and Labour Market,Employment and Labour Market,Employment and Labour Market,Employment and Labour Market,Employment and Labour Market,Employment and Labour Market,Employment and Labour Market,Employment and Labour Market,Employment and Labour Market,Employment and Labour Market,Employment and Labour Market,Employment and Labour Market,Employment and Labour Market,Employment and Labour Market,Employment and Labour Market,Employment and Labour Market,Employment and Labour Market,Employment and Labour Market,Employment and Labour Market,Employment and Labour Market,Employment and Labour Market,Employment and Labour Market,Employment and Labour Market,Employment and Labour Market,Employment and Labour Market,Employment and Labour Market,Employment and Labour Market,Employment and Labour Market,Employment and Labour Market,Employment and Labour Market,Employment and Labour Market,Employment and Labour Market,Employment and Labour Market,Employment and Labour Market,Employment and Labour Market,Employment and Labour Market,Employment and Labour Market,,"People, Population and Community","People, Population and Community","People, Population and Community","People, Population and Community","People, Population and Community","People, Population and Community","People, Population and Community","People, Population and Community","People, Population and Community","People, Population and Community","People, Population and Community","People, Population and Community","People, Population and Community","People, Population and Community","People, Population and Community","People, Population and Community","People, Population and Community","People, Population and Community","People, Population and Community","People, Population and Community","People, Population and Community","People, Population and Community","People, Population and Community","People, Population and Community","People, Population and Community","People, Population and Community","People, Population and Community","People, Population and Community","People, Population and Community","People, Population and Community","People, Population and Community","People, Population and Community","People, Population and Community","People, Population and Community","People, Population and Community","People, Population and Community","People, Population and Community","People, Population and Community","People, Population and Community","People, Population and Community","People, Population and Community","People, Population and Community","People, Population and Community","People, Population and Community","People, Population and Community","People, Population and Community","People, Population and Community","People, Population and Community","People, Population and Community","People, Population and Community","People, Population and Community","People, Population and Community","People, Population and Community","People, Population and Community","People, Population and Community","People, Population and Community","People, Population and Community","People, Population and Community","People, Population and Community","People, Population and Community","People, Population and Community","People, Population and Community","People, Population and Community","People, Population and Community","People, Population and Community","People, Population and Community","People, Population and Community","People, Population and Community","People, Population and Community","People, Population and Community","People, Population and Community","People, Population and Community","People, Population and Community","People, Population and Community","People, Population and Community","People, Population and Community","People, Population and Community","People, Population and Community","People, Population and Community","People, Population and Community","People, Population and Community","People, Population and Community","People, Population and Community"
"Business Activity, Size and Location","Business Activity, Size and Location","Business Activity, Size and Location","Business Activity, Size and Location","Business Activity, Size and Location",Retail Industry,Retail Industry,Retail Industry,Retail Industry,Retail Industry,Retail Industry,International Trade,International Trade,International Trade,International Trade,International Trade,International Trade,Construction Industry,Construction Industry,Construction Industry,Construction Industry,Construction Industry,Construction Industry,Changes to Business,Changes to Business,Changes to Business,Changes to Business,Changes to Business,Changes to Business,Changes to Business,IT and Internet Industry,IT and Internet Industry,IT and Internet Industry,IT and Internet Industry,Manufacturing and Production Industry,Manufacturing and Production Industry,Manufacturing and Production Industry,Manufacturing and Production Industry,Tourism Industry,Tourism Industry,Tourism Industry,Tourism Industry,,Gross Domestic Product (GDP),Gross Domestic Product (GDP),Gross Domestic Product (GDP),Gross Domestic Product (GDP),Gross Domestic Product (GDP),Gross Domestic Product (GDP),Gross Domestic Product (GDP),Gross Domestic Product (GDP),Gross Domestic Product (GDP),Gross Domestic Product (GDP),Gross Domestic Product (GDP),Gross Domestic Product (GDP),Gross Domestic Product (GDP),Gross Domestic Product (GDP),Gross Domestic Product (GDP),Gross Domestic Product (GDP),Gross Domestic Product (GDP),Gross Domestic Product (GDP),Gross Domestic Product (GDP),Gross Domestic Product (GDP),Gross Domestic Product (GDP),Inflation and Price Indices,Inflation and Price Indices,Inflation and Price Indices,Inflation and Price Indices,Inflation and Price Indices,Inflation and Price Indices,Inflation and Price Indices,Inflation and Price Indices,Inflation and Price Indices,Inflation and Price Indices,Balance of Payments,Balance of Payments,Balance of Payments,Balance of Payments,Balance of Payments,Balance of Payments,"Government, Public Sector and Taxes","Government, Public Sector and Taxes","Government, Public Sector and Taxes","Government, Public Sector and Taxes","Government, Public Sector and Taxes","Government, Public Sector and Taxes","Government, Public Sector and Taxes","Government, Public Sector and Taxes","Government, Public Sector and Taxes","Government, Public Sector and Taxes","Government, Public Sector and Taxes","Government, Public Sector and Taxes","Government, Public Sector and Taxes","Government, Public Sector and Taxes",Economic Output and Productivity,Economic Output and Productivity,Economic Output and Productivity,Economic Output and Productivity,Economic Output and Productivity,Gross Value Added (GVA),Gross Value Added (GVA),Gross Value Added (GVA),Gross Value Added (GVA),Gross Value Added (GVA),Gross Value Added (GVA),Gross Value Added (GVA),Gross Value Added (GVA),Gross Value Added (GVA),Gross Value Added (GVA),Gross Value Added (GVA),Gross Value Added (GVA),Gross Value Added (GVA),"Investments, Pensions and Trusts","Investments, Pensions and Trusts","Investments, Pensions and Trusts",Regional Accounts,Regional Accounts,Regional Accounts,Regional Accounts,Regional Accounts,Regional Accounts,Regional Accounts,Regional Accounts,Regional Accounts,Regional Accounts,Regional Accounts,Regional Accounts,Regional Accounts,Regional Accounts,Environmental Accounts,Environmental Accounts,Environmental Accounts,Environmental Accounts,,People in Work,People in Work,People in Work,People in Work,People in Work,People in Work,People in Work,People in Work,People in Work,People in Work,People in Work,People in Work,People in Work,People in Work,People in Work,People in Work,People in Work,People in Work,People in Work,People in Work,People in Work,People in Work,People not in Work,People not in Work,People not in Work,People not in Work,People not in Work,People not in Work,People not in Work,People not in Work,People not in Work,Public Sector Personnel,Public Sector Personnel,Public Sector Personnel,Public Sector Personnel,Public Sector Personnel,Public Sector Personnel,,Population and Migration,Population and Migration,Population and Migration,Population and Migration,Population and Migration,Population and Migration,Population and Migration,Population and Migration,Population and Migration,Population and Migration,Population and Migration,Population and Migration,Population and Migration,Population and Migration,"Births, Deaths and Marriages","Births, Deaths and Marriages","Births, Deaths and Marriages","Births, Deaths and Marriages","Births, Deaths and Marriages","Births, Deaths and Marriages","Births, Deaths and Marriages","Births, Deaths and Marriages","Births, Deaths and Marriages","Births, Deaths and Marriages","Births, Deaths and Marriages","Births, Deaths and Marriages","Births, Deaths and Marriages","Births, Deaths and Marriages","Births, Deaths and Marriages","Births, Deaths and Marriages","Births, Deaths and Marriages","Births, Deaths and Marriages","Births, Deaths and Marriages","Births, Deaths and Marriages","Births, Deaths and Marriages","Births, Deaths and Marriages","Births, Deaths and Marriages","Births, Deaths and Marriages","Births, Deaths and Marriages","Births, Deaths and Marriages","Births, Deaths and Marriages","Births, Deaths and Marriages","Births, Deaths and Marriages","Births, Deaths and Marriages","Births, Deaths and Marriages","Births, Deaths and Marriages","Births, Deaths and Marriages","Births, Deaths and Marriages","Births, Deaths and Marriages","Births, Deaths and Marriages","Births, Deaths and Marriages","Births, Deaths and Marriages","Births, Deaths and Marriages","Births, Deaths and Marriages","Births, Deaths and Marriages","Births, Deaths and Marriages","Births, Deaths and Marriages",Health and Social Care,Health and Social Care,Health and Social Care,Health and Social Care,Health and Social Care,Health and Social Care,Health and Social Care,Health and Social Care,Health and Social Care,Health and Social Care,Health and Social Care,Health and Social Care,Crime and Justice,Crime and Justice,Crime and Justice,Cultural Identity,Cultural Identity,Cultural Identity,Cultural Identity,Cultural Identity,Cultural Identity,Cultural Identity,Cultural Identity,Cultural Identity,Cultural Identity,Cultural Identity
,,,,,,,,,,,,,,,,,,,,,,,"Business Births, Deaths and Survival Rates","Business Births, Deaths and Survival Rates","Business Births, Deaths and Survival Rates",Mergers and Acquisitions,Mergers and Acquisitions,Mergers and Acquisitions,Mergers and Acquisitions,,,,,,,,,,,,,,,,,,,,,,,,,,,,,,,,,,,,,,,,,,,,,,,,,,,Public Sector Finance,Public Sector Finance,Public Sector Finance,Public Sector Finance,Public Sector Finance,Public Sector Finance,Public Sector Finance,Public Sector Finance,Research and Development Expenditure,Research and Development Expenditure,Research and Development Expenditure,Research and Development Expenditure,Research and Development Expenditure,Research and Development Expenditure,,,,,,,,,,,,,,,,,,,,,,,,,,,,,,,,,,,,,,,,,Employment and Employee Types,Employment and Employee Types,Employment and Employee Types,Employment and Employee Types,Employment and Employee Types,Employment and Employee Types,Employment and Employee Types,Earnings and Working Hours,Earnings and Working Hours,Earnings and Working Hours,Earnings and Working Hours,Earnings and Working Hours,Earnings and Working Hours,Earnings and Working Hours,Earnings and Working Hours,Labour Productivity,Labour Productivity,Labour Productivity,Workplace Disputes and Working Conditions,Workplace Disputes and Working Conditions,Workplace Disputes and Working Conditions,Workplace Disputes and Working Conditions,,,,,,,,,,,,,,,,,Population Estimates,Population Estimates,Population Estimates,Population Estimates,Population Estimates,Population Estimates,Population Estimates,Population Estimates,Population Estimates,International Migration,International Migration,International Migration,Population Projections,Migration within the UK,Live Births,Live Births,Live Births,Live Births,Deaths,Deaths,Deaths,Deaths,Deaths,Deaths,"Marriage, Cohabitation and Civil Partnerships","Marriage, Cohabitation and Civil Partnerships","Marriage, Cohabitation and Civil Partnerships",Life Expectancies,Life Expectancies,Life Expectancies,Life Expectancies,Divorce,Divorce,Divorce,Adoption,Adoption,Adoption,Adoption,Adoption,Ageing,Ageing,Ageing,Ageing,Conception and Fertility Rates,Conception and Fertility Rates,Conception and Fertility Rates,Conception and Fertility Rates,Conception and Fertility Rates,Families,Families,Families,Families,Families,Families,Families,Maternities,Stillbirths,Disability,Disability,Disability,Disability,"Drug use, Alcohol and Smoking","Drug use, Alcohol and Smoking","Drug use, Alcohol and Smoking",Conditions and Diseases,Conditions and Diseases,Conditions and Diseases,Conditions and Diseases,Conditions and Diseases,,,,Ethnicity,Ethnicity,Ethnicity,Ethnicity,Ethnicity,Sexuality,Sexuality,Sexuality,Sexuality,Sexuality,Sexuality
UK businesses,GB businesses,England and Wales businesses,England businesses,Wales businesses,Retail Sales Value including automotive fuel ,Retail Sales Value excluding automotive fuel ,Retail Sales Value including automotive fuel percentage change on same month a year earlier ,Retail Sales Volume including automotive fuel ,Retail Sales Volume excluding automotive fuel ,Retail Sales Volume including automotive fuel percentage change on same month a year earlier ,Trade in goods and services defecit (or surplus),Total imports in goods and services,Total exports in goods and services,Balance of trade in goods from EMU member,Balance of trade in goods from all EU,Balance of trade in goods from all Non-EU,Value of construction output  - all new work,Value of construction output - all work,Value of construction output - repariand mainanence,Construction output - all new work,Construction output - all work,Construction output - repariand mainanence,Business births,Business deaths,Survival rate for businesses born in 2007 and 2012 ,Number of acquisitions,Value of acquisitions,Number of disposals,Value of disposals,Total e-commerce sales,E-commerce sales (% turnover),Business with a website,Business with a broadband,Index of Production,Index of Production,Manufacturing,Manufacturing,Overseas visits to the UK,UK visits abroad,Overseas visits to UK Earnings ,UK visits abroad Expenditure  ,,Chained Volume Measures - Gross Domestic Product,Chained Volume Measures - GDP Quarter on Quarter growth ,Chained Volume Measures - GDP Change on same Quarter a year ago ,Current Prices - Gross Domestic Product ,Current Prices - GDP Quarter on Quarter growth ,Current Prices - GDP Change on same Quarter a year ago ,Output Measure - Production Index ,Output Measure - Manufacturing,"Output Measure - Agriculture, Forestry and Fishing",Output Measure - Construction Index ,Output Measure - Services Index ,Income Measure - Compensation of Employees ,Income Measure - Gross Operating Surplus ,Income Measure - Other Income ,Income Measure - Taxes less Subsidies ,Expenditure Measure - Households ,Expenditure Measure - Non-profit institutions serving households (NPISHs) ,Expenditure Measure - General Government ,Expenditure Measure - Gross Fixed Capital Formation ,"GDP (average) per head, at current market prices ","GDP (average) per head, Chained Volume Measures (CVM) market prices ",CPI,CPI,CPIH ,CPIH ,RPI,RPI,RPIJ,RPIJ,Output of manufactured product Index ,Input of all manufacturing Index ,Balance of Payments: Current balance,Balance of Payments: Total trade,Balance of Payments: Total income,Total exports of goods and services ,Total imports of goods and services,Current Transfers,Public sector net borrowing excluding financial interventions,Public Sector net debt excluding banks,Public Sector net debt excluding banks as a percentage of GDP,Public Sector current budget excluding banks,Public Sector net lending excluding banks,Public Sector current budget,Public Sector net investment,Public Sector Net Cash Requirement (NCR),Gross domestic expenditure on research and development,Government expenditure on research and development,Research Councils expenditure on research and development,Business Enterprise expenditure on research and development,Higher Education expenditure on research and development,Private Non-Profit expenditure on research and development,Production Index ,Manufacturing,"Agriculture, Forestry and Fishing",Construction Index ,Services Index ,United Kingdom,North East Gross Value Added,North West Gross Value Added,Yorkshire and The Humber Gross Value Added,East Midlands Gross Value Added,West Midlands Gross Value Added,East of England Gross Value Added,London Gross Value Added,South East Gross Value Added,South West Gross Value Added,Wales Gross Value Added,Scotland Gross Value Added,Northern Ireland Gross Value Added,Net investment flows into the UK,Net flow of direct investment abroad by UK companies,Net investment flows to Europe,Gross Disposable Household Income United Kingdom,Gross Disposable Household Income North East,Gross Disposable Household Income North West,Gross Disposable Household Income Yorkshire and The Humber,Gross Disposable Household Income East Midlands,Gross Disposable Household Income West Midlands,Gross Disposable Household Income East of England,Gross Disposable Household Income London,Gross Disposable Household Income South East,Gross Disposable Household Income South West,Gross Disposable Household Income England,Gross Disposable Household Income Wales,Gross Disposable Household Income Scotland,Gross Disposable Household Income Northern Ireland,Total energy consumption,Greenhouse gas emissions (CO2 equivalent),Revenue from environmentally related taxes,Spend on environmental protection activities,,Employment rate (aged 16-64),Employment 16+,Employment 16+ Female,Employment 16+ Male,Employment Rate (aged 16-64) Female,Employment Rate (aged 16-64) Male,Vacancies,Average weekly earning (total pay),Average weekly earning growth rate (total pay),Average weekly earning (regular pay),Average weekly earning growth rate (regular pay),Average weekly earning (bonus pay),Average weekly earning growth rate (bonus pay),Average weekly hours worked – full time,Average weekly hours worked – part time,Output per worker,Output per job,Output per hour,Working days lost,Working days lost in the Public Sector ,Working days lost in the Private Sector ,Number of stoppages,Unemployment rate (aged 16-64),Unemployment 16+,Unemployment 16+ Female,Unemployment 16+ Male,Unemployment Rate (aged 16-64) Female,Unemployment Rate (aged 16-64) Male,Total Claimant Count,Total Claimant Count Female,Total Claimant Count Male,Total public sector employees: Head count,Total public sector employees: Full time equivalent,Central government: Head count,Central government: Full time equivalent,Local government: Head count,Local government: Full time equivalent,,UK population ,Great Britain population,England and Wales population,England population,Scotland population,Wales population,Northern Ireland population,Males in the UK,Females in the UK,Net long-term migration to the UK,Immigration to the UK,Emigration from the UK,Mid-2037 UK population projected to reach,Residents moving between local authorities ,Live births in England and Wales ,Total fertility rate,Live births outside marriage,Live births to non-UK born mothers,UK deaths,England and Wales deaths,England deaths,Wales deaths,Scotland deaths,Northern Ireland deaths,Marriages,Civil partnerships,General Marriage Rate,Male Life expectancy at birth,Female Life expectancy at birth,Male Life expectancy at age 65,Female Life expectancy at age 65,Number of Divorces,Average age at divorce: Men,Average age at divorce: Women,Adoptions in England and Wales,Adoptions in England and Wales: Males,Adoptions in England and Wales: Females,Adoptions of children born within marriage,Adoptions of children born outside marriage,Centenarians in the UK,People aged 90 and over,Men aged 90 and over,Women aged 90 and over,Conceptions (all ages),Under 18 conceptions,Under 18 conception rate,Average completed family size,Childlessness,Families,Married or civil partner couple families (with dependent children),Married or civil partner couple families (without dependent children),Cohabiting couple families (with dependent children),Cohabiting couple families (without dependent children),Lone parent families (with dependent children),Lone parent families (without dependent children),Number of maternities,Number of stillbirths,Long-term health problem or disability,Day-to-day activities limited a lot,Day-to-day activities limited1 a little,Day-to-day activities not limited,Deaths from drug-related poisoning,Deaths from drug misuse,Alcohol-related deaths,Cancer survival rate,Cancer mortality,Cancer Incidence,Deaths from MRSA,Deaths Involving Clostridium difficile,Crimes recorded by police,Incidents of anti-social behaviour,Crimes against households,White,Mixed/ Multiple Ethnic Groups,Asian/Asian British,Black/African/Caribbean/Black British,Other Ethnic Group,"Adults identifying themselves as Gay, Lesbian or Bisexual",Heterosexual / Straight,Gay / Lesbian,Bisexual,Other,Don't know / Refusal
Y,N,N,N,N,Y,N,N,N,N,N,Y,N,N,N,N,N,Y,N,N,N,N,N,Y,N,N,Y,N,N,N,Y,N,N,N,Y,N,N,N,Y,N,N,N,,Y,N,N,N,N,N,N,N,N,N,N,N,N,N,N,N,N,N,N,N,N,Y,N,N,N,N,N,N,N,N,N,Y,N,N,N,N,N,Y,N,N,N,N,N,N,N,Y,N,N,N,N,N,Y,N,N,N,N,Y,N,N,N,N,N,N,N,N,N,N,N,N,Y,N,N,Y,N,N,N,N,N,N,N,N,N,N,N,N,N,Y,N,N,N,,Y,N,N,N,N,N,N,Y,N,N,N,N,N,N,N,Y,N,N,Y,N,N,N,Y,N,N,N,N,N,N,N,N,Y,N,N,N,N,N,,Y,N,N,N,N,N,N,N,N,Y,N,N,Y,Y,Y,N,N,N,Y,N,N,N,N,N,Y,N,N,Y,N,N,N,Y,N,N,Y,N,N,N,N,Y,N,N,N,Y,N,N,N,N,Y,N,N,N,N,N,N,Y,Y,Y,N,N,N,Y,N,N,Y,N,N,N,N,Y,N,N,Y,N,N,N,N,Y,N,N,N,N,N
